{
  "$schema": "./node_manifest.schema.json",
  "nodeName": "Node_A",
  "nodeId": "node-a-001",
  "role": "general",
  "specialization": ["mine", "build", "analyze"],
  "peers": [
    {
      "name": "Node_B",
      "url": "ws://localhost:8901",
      "specialization": ["dialogue", "explore"],
      "priority": 1,
      "weight": 1.0,
      "enabled": true
    },
    {
      "name": "Node_C",
      "url": "ws://localhost:8902",
      "specialization": ["gather", "logistics"],
      "priority": 2,
      "weight": 1.0,
      "enabled": true
    }
  ],
  "taskRouting": {
    "strategy": "best-fit",
    "fallbackToLocal": true,
    "retryAttempts": 3,
    "retryDelay": 1000,
    "taskTimeout": 30000
  }
}